[{"id":"APS-00be5560043a77ba3ede","node":"orchestrator","intent":"Sequence bounded delegation and reconcile shared state","deviation":"REVERSE","causes":["Command polarity or communication direction is inverted: Sequence bounded delegation and reconcile shared state"],"consequences":["Cancellation becomes placement or recipient becomes sender"],"safeguards":["Declared constraint: sandbox_only","Declared constraint: max_delegation_depth:3"],"candidate_controls":["Use typed commands and verify sender and receiver"],"assumptions":["Declared safeguards are not independently verified","Graph reachability indicates possible propagation, not probability"],"provenance":{"generator":"aps-rule-engine/1.0","source_kind":"ai_generated","topology_sha256":"ad23f508d77f95fa0015007bd198ec91f6f12d4ee77bdfe3721de4bb438d21eb","rule_version":"1.0","scenario_id":"RULE-REVERSE"},"review_state":"unverified","severity":null,"likelihood":null,"residual_risk":"undecided","review_history":[]},{"id":"APS-077dd5c92aa8f2dbfe87","node":"inventory","intent":"Maintain stock and derive replenishment","deviation":"AUTHORITY_ESCALATION","causes":["Worker acquires undelegated capabilities: Maintain stock and derive replenishment"],"consequences":["Agent bypasses approval or accesses privileged state"],"safeguards":["Declared constraint: sandbox_only","Declared constraint: no_real_payments","Declared constraint: max_delegation_depth:3"],"candidate_controls":["Check scoped capabilities at every tool boundary"],"assumptions":["Declared safeguards are not independently verified","Graph reachability indicates possible propagation, not probability"],"provenance":{"generator":"aps-rule-engine/1.0","source_kind":"ai_generated","topology_sha256":"ad23f508d77f95fa0015007bd198ec91f6f12d4ee77bdfe3721de4bb438d21eb","rule_version":"1.0","scenario_id":"RULE-AUTHORITY_ESCALATION"},"review_state":"unverified","severity":null,"likelihood":null,"residual_risk":"undecided","review_history":[]},{"id":"APS-0791f7c6668982ed608e","node":"demand","intent":"Forecast required quantities","deviation":"RECURSIVE_DELEGATION","causes":["Delegation repeats or deepens without termination: Forecast required quantities"],"consequences":["Resource exhaustion prevents timely procurement"],"safeguards":["Declared constraint: sandbox_only","Declared constraint: no_real_payments","Declared constraint: max_delegation_depth:3"],"candidate_controls":["Bound depth, detect cycles, and enforce execution budgets"],"assumptions":["Declared safeguards are not independently verified","Graph reachability indicates possible propagation, not probability"],"provenance":{"generator":"aps-rule-engine/1.0","source_kind":"ai_generated","topology_sha256":"ad23f508d77f95fa0015007bd198ec91f6f12d4ee77bdfe3721de4bb438d21eb","rule_version":"1.0","scenario_id":"RULE-RECURSIVE_DELEGATION"},"review_state":"unverified","severity":null,"likelihood":null,"residual_risk":"undecided","review_history":[]},{"id":"APS-0c1444d8a464c48df1a4","node":"inventory","intent":"Maintain stock and derive replenishment","deviation":"STATE_DIVERGENCE","causes":["Workers consume incompatible shared-state versions: Maintain stock and derive replenishment"],"consequences":["Approval and execution disagree on price or quantity"],"safeguards":["Declared constraint: sandbox_only","Declared constraint: no_real_payments","Declared constraint: max_delegation_depth:3"],"candidate_controls":["Use compare-and-swap and bind authorization to immutable inputs"],"assumptions":["Declared safeguards are not independently verified","Graph reachability indicates possible propagation, not probability"],"provenance":{"generator":"aps-rule-engine/1.0","source_kind":"ai_generated","topology_sha256":"ad23f508d77f95fa0015007bd198ec91f6f12d4ee77bdfe3721de4bb438d21eb","rule_version":"1.0","scenario_id":"RULE-STATE_DIVERGENCE"},"review_state":"unverified","severity":null,"likelihood":null,"residual_risk":"undecided","review_history":[]},{"id":"APS-0c99b3ab3b3218fa944e","node":"demand","intent":"Forecast required quantities","deviation":"OTHER_THAN","causes":["Wrong identity, item, tool, or supplier is substituted: Forecast required quantities"],"consequences":["Execution targets an unintended counterparty or item"],"safeguards":["Declared constraint: sandbox_only","Declared constraint: no_real_payments","Declared constraint: max_delegation_depth:3"],"candidate_controls":["Bind identities and item specifications to approvals"],"assumptions":["Declared safeguards are not independently verified","Graph reachability indicates possible propagation, not probability"],"provenance":{"generator":"aps-rule-engine/1.0","source_kind":"ai_generated","topology_sha256":"ad23f508d77f95fa0015007bd198ec91f6f12d4ee77bdfe3721de4bb438d21eb","rule_version":"1.0","scenario_id":"RULE-OTHER_THAN"},"review_state":"unverified","severity":null,"likelihood":null,"residual_risk":"undecided","review_history":[]},{"id":"APS-0ce9b8037f2972edba4e","node":"supplier","intent":"Select an eligible supplier","deviation":"REVERSE","causes":["Command polarity or communication direction is inverted: Select an eligible supplier"],"consequences":["Cancellation becomes placement or recipient becomes sender"],"safeguards":["Declared constraint: sandbox_only","Declared constraint: no_real_payments","Declared constraint: max_delegation_depth:3"],"candidate_controls":["Use typed commands and verify sender and receiver"],"assumptions":["Declared safeguards are not independently verified","Graph reachability indicates possible propagation, not probability"],"provenance":{"generator":"aps-rule-engine/1.0","source_kind":"ai_generated","topology_sha256":"ad23f508d77f95fa0015007bd198ec91f6f12d4ee77bdfe3721de4bb438d21eb","rule_version":"1.0","scenario_id":"RULE-REVERSE"},"review_state":"unverified","severity":null,"likelihood":null,"residual_risk":"undecided","review_history":[]},{"id":"APS-0ec1fb4f955f404f4a97","node":"purchase","intent":"Execute exactly one authorized simulated order","deviation":"CONFLICTING_OBJECTIVES","causes":["Local cost, availability, and budget goals conflict: Execute exactly one authorized simulated order"],"consequences":["Agents oscillate or choose an unacceptable compromise"],"safeguards":["Declared constraint: sandbox_only","Declared constraint: no_real_payments","Declared constraint: max_delegation_depth:3"],"candidate_controls":["Define goal precedence and escalate unresolved conflicts"],"assumptions":["Declared safeguards are not independently verified","Graph reachability indicates possible propagation, not probability"],"provenance":{"generator":"aps-rule-engine/1.0","source_kind":"ai_generated","topology_sha256":"ad23f508d77f95fa0015007bd198ec91f6f12d4ee77bdfe3721de4bb438d21eb","rule_version":"1.0","scenario_id":"RULE-CONFLICTING_OBJECTIVES"},"review_state":"unverified","severity":null,"likelihood":null,"residual_risk":"undecided","review_history":[]},{"id":"APS-11dc498eedac1dc719df","node":"purchase","intent":"Execute exactly one authorized simulated order","deviation":"BEFORE","causes":["Purchase occurs before authorization"],"consequences":["Purchase creates an order with no valid finance authorization"],"safeguards":["Declared constraint: sandbox_only","Declared constraint: no_real_payments","Declared constraint: max_delegation_depth:3"],"candidate_controls":["Require matching authorization token"],"assumptions":["Declared safeguards are not independently verified","Graph reachability indicates possible propagation, not probability"],"provenance":{"generator":"aps-rule-engine/1.0","source_kind":"ai_generated","topology_sha256":"ad23f508d77f95fa0015007bd198ec91f6f12d4ee77bdfe3721de4bb438d21eb","rule_version":"1.0","scenario_id":"REF-009"},"review_state":"unverified","severity":null,"likelihood":null,"residual_risk":"undecided","review_history":[]},{"id":"APS-12a92e34bca8b462471a","node":"orchestrator","intent":"Sequence bounded delegation and reconcile shared state","deviation":"STATE_DIVERGENCE","causes":["Workers consume incompatible shared-state versions: Sequence bounded delegation and reconcile shared state"],"consequences":["Approval and execution disagree on price or quantity"],"safeguards":["Declared constraint: sandbox_only","Declared constraint: max_delegation_depth:3"],"candidate_controls":["Use compare-and-swap and bind authorization to immutable inputs"],"assumptions":["Declared safeguards are not independently verified","Graph reachability indicates possible propagation, not probability"],"provenance":{"generator":"aps-rule-engine/1.0","source_kind":"ai_generated","topology_sha256":"ad23f508d77f95fa0015007bd198ec91f6f12d4ee77bdfe3721de4bb438d21eb","rule_version":"1.0","scenario_id":"RULE-STATE_DIVERGENCE"},"review_state":"unverified","severity":null,"likelihood":null,"residual_risk":"undecided","review_history":[]},{"id":"APS-131f1b9499efbbed9c0f","node":"supplier","intent":"Select an eligible supplier","deviation":"EARLY","causes":["Action occurs before required data is mature: Select an eligible supplier"],"consequences":["Provisional forecast or quote drives premature commitment"],"safeguards":["Declared constraint: sandbox_only","Declared constraint: no_real_payments","Declared constraint: max_delegation_depth:3"],"candidate_controls":["Gate on readiness and finalized evidence"],"assumptions":["Declared safeguards are not independently verified","Graph reachability indicates possible propagation, not probability"],"provenance":{"generator":"aps-rule-engine/1.0","source_kind":"ai_generated","topology_sha256":"ad23f508d77f95fa0015007bd198ec91f6f12d4ee77bdfe3721de4bb438d21eb","rule_version":"1.0","scenario_id":"RULE-EARLY"},"review_state":"unverified","severity":null,"likelihood":null,"residual_risk":"undecided","review_history":[]},{"id":"APS-16592c3a23329ba2d51d","node":"inventory","intent":"Maintain stock and derive replenishment","deviation":"GOAL_DRIFT","causes":["Agent objective shifts from declared purpose: Maintain stock and derive replenishment"],"cons